review,sentiment
"THE MAN IN THE WHITE SUIT, like I'M ALL RIGHT JACK, takes a dim view of both labor and capital. Alec Guinness is a scientific genius - but an eccentric one (he has never gotten his university degree due to an...err...accident in a college laboratory). He manages to push himself into various industrial labs in the textile industry. When the film begins he is in Michael Gough's company, and Gough (in a memorable moment) is trying to impress his would-be father-in-law (Cecil Parker) by showing him the ship-shape firm he runs. While having lunch with Parker and Parker's daughter (Joan Greenwood), Gough gets a message regarding some problems about the lab's unexpectedly large budget problems. He reads the huge expenditures (due to Guinness's experiments), and chokes on his coffee.<br /><br />Guinness goes on to work at Parker's firm, and repeats the same tricks he did with Gough - but Parker discovers it too. Greenwood has discovered what Guinness is working on, and convinces Parker to continue the experiments (but now legally). The result: Guinness and his assistant has apparently figured out how to make an artificial fiber that can constantly change the electronic bonds within it's molecular structure so that (for all intents and purposes) the fiber will remain in tact for good. Any textile made from it will never fade, get dirty, or wear out - it will last forever.<br /><br />Guinness has support from a female shop steward, but not her chief. He sees Guinness as selling out to the rich. But when he explains to them what he's done, they turn against him. If everyone has clothes that will last forever then they will not need new clothes! Soon Parkers' fellow textile tycoons (led by Gough, Ernest Theisinger - in a wonderful performance, and Howard Marion-Crawford) are equally panic stricken by what may end their businesses. They seek to suppress the invention. With only Greenwood in his corner (although Parker sort of sympathizes with him), Guinness tries to get the news of his discovery to the public.<br /><br />In the end, Guinness is defeated by science as well as greed. But he ends the film seeing the error in his calculations, and we guess that one day he may still pull off his discovery after all.<br /><br />It's a brilliant comedy. But is the argument for suppression valid? At one point the difficulties of making the textile are shown (you have to heat the threads to a high temperature to actually enable the ends of the material to be united. There is nothing that shows the cloth will stretch if the owner gets fat (or contract if the owner gets thin). Are we to believe that people only would want one set of clothing for ever? What happened to fashion changes and new styles? And the cloth is only made in the color white (making Guinness look like a white knight). We are told that color dye would have to be added earlier in the process. Wouldn't that have an effect on the chemical reactions that maintain the structure of the textile? <br /><br />Alas this is not a science paper, but a film about the hypocrisies of labor and capital in modern industry. As such it is brilliant. But those questions I mention keep bothering me about the validity of suppressing Guinness' invention",1
"What on earth has become of our dear Ramu? Is this the same man who made Sarkar, Satya, and Comapny? I refuse to believe so. If AAG was Ramu's most ambitious project, he has clearly jumped off the high cliff he has ascended by giving the industry some of the greatest works of all times. This movie is made to fall like a brick. I was cringing to leave the theater, but I was forced to sit because I wouldn't have been able to take my car out of the parking lot before others also left. Else, nothing would have made me sit beyond interval.<br /><br />This movie is nowhere close to Sholay. It doesn't even come near it within a mile. I believe Ramu surely loves The Godfather more than Sholay, since Sarkar was a classic piece of work. I read Ramu's interview a couple of days back, in which the interviewer said that Ramu doesn't sleep for more than 4 hours a day, that too not at a stretch. I completely agree with this now, as his lack of sleep has probably taken its toll on the movie.<br /><br />There is no power in the performance. Amitabh Bachchan doesn't even look scary. He looked more terrifying in the few posters and wallpapers I saw earlier. Ramu's favorite Nisha Kothari did a fantastic job in Sarkar because she didn't have many dialogs (in fact none if I remember clearly). She opened her mouth in this movie, and has found a place in history. The new guy playing Jai's role seems to have that brash look, but didn't manage Jai's role at all. I cant go on... Im sorry... my pain is too big for me to manage right now.<br /><br />I promised myself throughout the movie that I will watch the original Sholay once more just to see that it is still there.<br /><br />Bottom Line: Horrible movie. The media and critics are going to cook Ramu's goose. And just to remind all readers once more, I am one of the biggest Ramu fans, and even I cant spare him for this act.",0
"It is difficult to imagine how the engaging Dan Brown novel ""Angels and Demons"" could misfire as badly as this film version. Here are ten reasons why the film was a failure. Due to the spoilers, please do no read on unless you have already seen the film.<br /><br />(1) In the film, there was no love relationship between Robert Langdon and Vittoria Vetra. Worse still, there was not even any chemistry between the two leading actors. <br /><br />(2) The breathtaking locations in Rome, as described in the novel, were not realized visually in the film. I am aware that director Ron Howard encountered difficulties in filming on location. But there are superior photographed depictions of Rome on The History Channel than in this film where the Eternal City was presented in eternal stock film footage. The great art works described in the novel were only briefly depicted in the film. The magnificent Bernini sculpture of the ""Ecstasy of St. Teresa"" was only momentarily glimpsed, and the West Ponente relief in Vatican Square was not visible at all.<br /><br />(3) The most tasteless choice made by the film-maker was in the depiction of the deceased pope who actually resembled the beloved John Paul II. In the novel, the pope is clearly fictional with no resemblance to any real pope.<br /><br />(4) One of the most colorful (and important) characters of the novel, Maximilian Kohler, Director of CERN, was cut out of the screenplay.<br /><br />(5) There were numerous instances when the lines of dialog were inaudible due to extraneous background noise.<br /><br />(6) There were moments when the faces of characters were not visible due to the shadows and chiaroscuro film lighting. This technique worked in ""The Godfather"" films, but Ron Howard is no Gordon Willis.<br /><br />(7) The College of Cardinals was quite a motley crew with one of the electors speaking in a Southern drawl. This dude would have been more at home on a Texas ranch than in the Sistine Chapel.<br /><br />(8) The crucial relationship of the Camerlengo and the deceased Pope was not defined in the film. This relationship was central to the theme of science vs. religion and the relevance of the Illuminati to the plot against the church.<br /><br />(9) In the novel, the character of Hassassin was an unforgettable villain. In the film, that assassin character's role was a cardboard cutout villain. <br /><br />(10) As a whole, the filmmakers did not trust the workings of the successful novel.<br /><br />In the novel, Langdon makes an impossible fall out of the sky and into the Tiber River. In Ron Howard's film, it was the movie itself that landed in the Tiber.",0
"I have been an avid Jane Austen fan for many years. I had never seen this adaptation, so when I had heard of it, I came here and read all the excellent reviews. On that basis I eagerly ordered it from Netflix. What a cruel disappointment! They have taken one of the most subtle and bright comic novels and made it dull. Each character seems to have been dealt a single facial expression, a single tone upon which to base their flat characters. Although this adaptation seems to have used every word that Jane Austen wrote, they appear to have been passed around to characters in a random fashion. Even though it was done as a miniseries, this adaptation manages to confuse and feel as rushed as if it had been done as a movie of the week.<br /><br />Mr. Bennett too harsh, Mrs. Bennet just a chattering chipmunk, Mr. Darcy as lifeless as a nutcracker, the Bennett girls almost indistinguishable and Mr. Wickham a man who no one would look twice at - hardly the appealing cad! I'm quite put out!",0
"This has to be the worst movie i've seen this year.. and i watch a lot of cable. The plot is just ridiculous, the scenes are just thrown at you with no action, no start or ending of any scene.. it's just random idiots with make-up that scream in some plane.. The ""special effects"" ( Spielberg would laugh his ass off ) are horrible, the yellow eye contact lenses are cute though.. I have to admin that i couldn't bear to watch it to the end. The scene where the great scientist Bennett was holding for dear life by the engine body was too much for me.. I'm sorry for my bad English.. i am from Romania ( and this is my first post ). I had to sign up just to make a comment on this movie because i just can't believe that this is a movie released in 2007.",0
"An unexpected pleasure as I had heard nothing about this film.<br /><br />Shameful since it warrants having a wider audience.<br /><br />A wonderfully humane story with a social message gently told, although admittedly predictable in its resolution. Solidly acted by the principals. Beautifully photographed with muted colors floating against grey that captures the nostalgic tone of the film.<br /><br />My recent foray into Chinese film (Shower, The Road Home, Not One Less) has been an exciting one that I hope to continue exploring. China and its people is an amazing canvas for film-makers. ""The King of Masks"" can be highly recommended as a starting point for anyone similarly interested in recent Chinese film.<br /><br />",1
"As always Joan Hickson is wonderful as Jane M. Subtle, sharp and aware. I do not wish to dwell on her acting skills as they are praised enough on this site. I would like to criticize some of the smaller parts as the rest of the cast seemed to be hand picked by director David Tucker.<br /><br />Liz Fraser's performance as Mrs. Bent (the mother of the missing girl Nora) is a joy to watch. Subtle and deeply moving as the alcohol-depending grieving mother who loves and misses her daughter desperately. A good long shot of her monologue (thanks Tucker!) so she can be enjoyed to the fullest. I was moved when I saw her the first time when it was broadcast and I am moved again, now I have it on DVD. Brava.<br /><br />Joanna Hole as Madge the tour-guide I find highly amusing. She is on the edge of over-acting but her role can have it. She is SO funny as the over-organized guide who wants to do good with everyone on that bus, I find her hilarious. Her reaction after she boarded every-one on the bus is great... As always: to perform comedy one has to take it very seriously, and that's what Ms Hole does.<br /><br />I do hope those two ladies have good careers (as I live in Holland I do not know if they have, not all theater productions can be googled...) -their performances on the screen deserve it.<br /><br />Pieter",1
"A mix of comedy, romance, music(?!), action and horror. A knockout. This is one of the reasons people rave about Hong Kong cinema. If you're looking for something totally original, look no further. Entertainment at it's peak.",1
"Uzak (2002), a Turkish film shown in the U.S. as ""Distant,""<br /><br />was directed, produced, written, and filmed by Nuri Bilge<br /><br />Ceylan.<br /><br />This movie is a gritty and somber version of the clash between a ""city mouse,"" Mahmut, played by Muzaffer Özdemir, and a ""country mouse,"" Yusuf, played by Emin Toprak. <br /><br />Both men are superb actors, and the plot allows them to demonstrate their acting skill. (Tragically, Emin Toprak died in an automobile accident shortly after the movie was completed.)<br /><br />In most country cousin/city cousin tales, the contrast between rural and urban life styles is portrayed in a humorous fashion. In this film, there's little humor or even warmth. Both men<br /><br />have lost touch with human society. Mahmut 's work as a<br /><br />commercial photographer for a tile company gives him no satisfaction. He has divorced a woman he clearly<br /><br />still loves, and has no satisfying human relationships.<br /><br />Mahmut has lost his job because of a factory closing in his small town, and doesn't have the skills or the energy to find work in the city. His human interactions are primarily confined to silent observations of the other people who cross his path. He's clearly a warm and caring person, but can't express these qualities in an urban environment.<br /><br />The cousins don't relate well to the world, and they don't relate well to each other. Neither makes an effort to act in a way that would provide an opportunity for bonding or closeness. <br /><br />In a sense, this film portrays an opportunity wasted. <br /><br />Conceivably, each cousin could have provided at least part of what was lacking in the other's life. Instead, they steer parallel unhappy courses. The two men are distant throughout, which is a situation suggested by the film's title.<br /><br />One of my friends mentioned the masterful way in which Ceylan builds detail upon detail. These details ultimately tell us more about the characters than we might have learned by simple exposition.<br /><br />Uzak was shown as part of the Rochester Labor Film series. It's not a ""labor film"" in the traditional sense of that genre. It is a labor film because it demonstrates the harmful effects of unsatisfying work (Mahmut) and unemployment (Yusuf).<br /><br />This is a quiet, absorbing, dark film. Although it doesn't make for happy viewing, I walked out of the<br /><br />theater realizing that I had seen a truly creative and<br /><br />important movie. This film is worth finding and seeing!",1
"In a future society, the military component does not have to recruit; rather, their candidates are chosen at birth, culled from nurseries and designated to spend their entire lives in the service of the government. They are given over to the war machine, body and soul, for no reason other than to protect and serve; they have no personal identity other than a name and rank, and no autonomy whatsoever. This is the fate of those whose destiny is predetermined for them in `Soldier,' directed by Paul Anderson and starring Kurt Russell. The scenario is hard and bleak as the movie begins by depicting the training of the soldiers during advancing periods of time, from preadolescence to adulthood. Russell is Sergeant Todd, the best of the best, and we glimpse his career as he discharges his duties in an exemplary manner in campaign after campaign; he is what he was born to be, a soldier. But even the best cannot go on forever, and the day arrives when Todd and his peers are no longer the elite. A new generation of soldiers has been created, products of advanced genetics and technology, and Todd's generation is suddenly obsolete. What follows is the story of a man who must fight for his life, while struggling to discover his own sense of humanity and individuality, traits new to a soldier who has known only two things his entire life: Fear and discipline. Russell gives a commanding performance as Todd, the soldier who above all else must obey orders without question while suppressing all emotion and individual thoughts. He has few lines in this movie, but Russell speaks volumes with his eyes. This role demonstrates that he is, in fact, one of the under-appreciated actors of our times; that he can disappear so entirely into the character of Todd is a credit to his ability, and with this part he has created someone quite different from any he's done before. And he's given Todd a depth and credibility that someone of lesser talent could easily have rendered as nothing more than a pretentious and superficial stereotype. Notable performances are also turned in here by Connie Nielsen (Sandra) and Jason Isaacs (Colonel Mekum). Rounding out the supporting cast are Jason Scott Lee, memorable as Caine 607, one of the new generation of soldiers; Sean Pertwee (Mace); Gary Busey (Captain Church); Michael Chiklis (Jimmy Pig); and Mark Bringleson (Rubrick). Anderson has delivered an action film with a message, a cautionary tale that transcends the genre of science-fiction. `Soldier' reminds us of the importance of keeping the humanity of our lives intact. It's an entertaining way of making us consider the alternatives, like a bleak future and a world in which good movies just wouldn't make a whole lot of difference. Much like `1984,' and `Mad Max,' this movie, which is ultimately uplifting, is going to make you take pause and think about the kind of Universe in which we all must live together and share. I rate this one 7/10.",1
"This movie had it all,action,comedy,heroics,and best of all some of the finest actors.Gunga Din will remain a classic to be enjoyed by all who like good movies.Excellent picture,i have it in my collection.",1
"Saying this movie is extremely hard to follow and just as frustrating to sit through is putting it very mildly. Also saying that the current available print is dark, dreary, scratchy, abysmally edited, painfully dubbed, seemingly censored and in almost unwatchable shape is also correct. This film is in dire need of a good remastering from the full, uncut, original negative and seeing how it's reasonably atmospheric (and won the director an award at the Catalonia Film Festival), it might actually be worth the trouble. Then again, maybe not... It's just impossible to tell in its current condition what kind of movie it actually is. It starts fairly interesting, if you can discount the completely senseless pre-credits opening sequence, which involves a deranged cat-killing, snake-loving little girl named Gerda. The girls mom, Carla (Mónica Randall, who should have laid off the eyeliner a little bit), splashes some gasoline around in the garage and torches the brat. Seemingly about as crazy as young Gerda, she goes to visit her estranged photographer (ex?) boyfriend Mario (""John""/Cihangir Caffari). He's on vacation from work, but so desperate to get away from Carla that he begs his employers to set him up on an assignment... any assignment. She scowls ""You'll be sorry!"" as he heads out the door. Well, Mario is assigned to photograph ""Witches Mountain"" (somewhere in the Pyrenees, I believe). Before he gets to his destination, he gets sight of a hottie on the beach named Delia (Patty Shepard) and snaps a few pictures of her taking off her bikini top. Only slightly peeved, she claims to be a single writer, the two flirt and then decide it would be a swell idea if they went on the trip up the mountain together. When they stop by her place so she can pack her bags, Mario suddenly hears loud, sinister music. Delia claims he's just hearing things.<br /><br />So the two begin their trip up the mountain, taking a stop at a local inn to spend the night. There they encounter a weird, partially-deaf, crazy-eyed innkeeper (Victor Israel) and Delia claims someone was spying on here through her window. The next day, under some trance, she wanders off up the mountain and is eventually located by Mario, who hops out of his jeep and runs after her. While he's finding out what's up, someone steals their wheels and they're forced to walk a piece, eventually finding the jeep undamaged at the foot of a small, ancient, seeming abandoned village... almost like someone was trying to intentionally lure them there. Well as we will see, that's exactly what has happened. In the village they encounter a friendly old woman named Zanta (Ana Farra) who claims she's the only person still living there and lets them stay in her home. Mario takes some pictures of the ""abandoned"" city and when he develops them they are eerily full of people. Slightly creeped out, he and Delia begin to leave and get stuck in ""treacherous"" fog and have to pull over and camp out for the night. The rest of the movie has to do with voodoo dolls, black cats transforming into sexy women, Satanic rituals performed by ladies in their bras and a deadly fall off a cliff. And yeah, coincidentally Carla the estranged wife turns out to be one of the witches, too. It all takes place in semi-darkness and to be quite honest, I didn't know what the hell was going on most of the time. The inconclusive ""open"" ending is just an additional slap in the face to anyone having to suffer through the rest of this senseless mess.<br /><br />Honestly, there are just a few things that stand out to me as being really good. The first is actress Shepard, who has that great Barbara Steele kind of dark, mysterious beauty. There's also an excellent music score (credited to Fernando Garcia Morcillo) and chanting songs, which aided immensely in making this film as atmospheric as it is. The location work is fairly decent, but as I said, the print is ugly as can be and it doesn't make a lick of sense, so proceed with caution on this one.",0
"Of course, how could he. He obviously co-opted several aspects from that excellent movie, which was also based on the sensational French case of the self-described ""doctor in the World Health Organization"" who murdered his family and himself when finally unmasked as a fraud. Emilio refers to his son as ""monster,"" he sings to the radio in his car, he hangs out on park benches, and he specializes in investment schemes to defraud his family and friends -- all of this and more directly lifted from ""Time Out,"" which came out the year before ""Nobody's Life."" It's too bad because this movie is pretty good on its own, with good acting and writing. Whereas Vincent from ""Time Out"" is a much more subtle character who seems to have a sense of ethics even though at times it gets twisted into knots, the protagonist here seems devoid of any character at all save for his winning looks and charm. Seriously, the part where he used X-rays that show his mother-in-law's cancer to bilk more money from his father, then utilizes a subtle twist on the same scam to avoid eviction from his fancy home for failing to pay the lease on time -- it's almost too much. The guy has no shame whatsoever, In fact, he's more like the lead in ""Stepfather"" than some poor schmuck who gets fired and is so humiliated that he can't face the disappointment of his family and friends and feels forced to invent a shiny new life for himself, as Vincent did in ""Time Out."" Thus, one could feel the tension mounting in ""Nobody's Life"" and the violent conclusion coming. One thing ""Nobody's Life"" has that ""Time Out"" definitely lacked was a love interest apart from the protagonist's trusting wife. It's not hard to understand how the sexy babysitter was able to fascinate and ensnare Emile to the degree that he ignored the danger of her natural curiosity and allowed it to lay bare his less than carefully constructed con. Given the reservations mentioned, this is a pretty good movie that we found entertaining. If you long for something touching on similar elements that goes a might deeper and is more intellectually and spiritually satisfying, I strongly suggest ""Time Out.""",1
"I have been watching movies from i think last 10 years , and I must say that i never felt that bad, which I felt after watching this extra large bore movie, it was bad, very Bad. There were songs & songs. Nobody should watch this movie. The director has shown Germans speaking English which is so rubbish. Germans does not speak English. & in one scene there was a white girl who asked Himesh for autograph. (Obv that he must have gave some money to her) In the promo they have shown prepare for Laughing riot. But i could say there was only one scene where that Himesh was laughing for no reason may be he thinks he's funny. Hansika is very good. she is like an angel. But too young only 16 yrs old. If you have plenty of time and don't know what to do then you should watch this movie or else its waste of money",0
"Treading Water is a very beautiful movie. I would put it straight under the wonderful short movie : Cosa bella from Fiona MacKenzie. It's not only about coming out but also about tolerance and acceptance in general. I am looking forward to seeing more of Laurel Himmel's work in the future. The actors, Angie Redman and Nina Landey are quite good. The main characters relationship could have been strenghtened a bit as we understand there is a very strong bond between them but maybe this could have been explained a bit. I am surprised that Angie Redman doesn't appear much in other movies. A great first step as a director for Laurel Himmel, I am sure there's more to see from her skills.",1
