review,sentiment
"It's strange what fate does to some people. While looking in the discount bin at a DVD retailer, I came across a copy of Deadly Instincts. Being a collector of any film that is either sci-fi, horror or featuring alien monsters, I decided to buy it (not to mention the fact that it cost five dollars  a bargain, believe me). After viewing it, I came to the opinion that it was nothing special. But after doing some research on the Internet, I discovered that the film was actually called Breeders & was a remake of the Tim Kincaid horror flick that menaced video stores in the mid-1980s. Which I've already seen. My appreciation of ""Deadly Instincts"" grew following that discovery.<br /><br />A meteorite crashes on the lawn next to a private girls' college. The sole teacher there, Ashley (played by Todd Jensen  that's right, the guy who gets turned into a cyborg in the cult flick CYBORG COP four years earlier), notices that some of the students are beginning to disappear, while encountering a black-haired woman with a scarred face & wearing a kinky leather outfit. His investigation reveals that an alien creature had hitched a ride on the meteorite & had come to Earth to breed using the local womenfolk. Along with a local detective who believes him to be responsible for the disappearances, Ashley tries to stop the monster.<br /><br />The original BREEDERS, directed by Tim Kincaid (who would leave the genre to make gay porn), was a sci-fi / horror film which was actually a thinly-veiled soft-core porn film designed to take skin flicks to genre fans. It is, in my belief, one of the worst films made in the 1980s. Why anyone would want to remake it is quite a mystery.<br /><br />This remake is actually a better effort than its low-budget source. The film, which takes the basic concept of an alien monster trying to interbreed with human women, eliminates any pornographic elements. In fact, the film is actually very tame. There are no sex scenes, no nudity (even during the shower scene), swearing & violence are kept to a minimal level & there is no gore (which may cheat gorehounds). This makes the remake a film safe for the whole family, that is if the kids aren't scared by alien monsters (which brings me to the film's M 15+ rating, which seems a bit much).<br /><br />Tameness of subject matter aside, the film does have some faults. The script, while featuring some good characterizations, has a number of holes so big you can crash a meteor through.<br /><br />What? You're mad at me for that? Come on, this review needed a bad pun so it will remain interesting.<br /><br />Anyway, the film's setting is one problem the script failed to fix  the film is set in Boston but the buildings don't look like they belong in Boston. Something about the architecture ain't right. Another thing is the college itself, with a rather large building housing about twenty students (all female, of course) & only having one class  art. The only teacher there has a relationship with a student (& so does the janitor!), which somehow escapes the attention of the principal. Not to mention the cops, who are so one-dimensional (& stupid) that the real Boston PD would have a good case if they ever decided to sue. Oh, & the meteor well the chance that a meteor which is sent from Saturn (check the opening credits) reaches Earth with no onboard propulsion is astronomical. That doesn't include the chances that any passengers in the meteor will survive the landing.<br /><br />As far as the acting goes, Todd Jensen gives a dependable performance as the heroic teacher while the late Kadamba Simmons (who was murdered by her boyfriend shortly before the film came out) cuts a striking figure in that leather outfit, as well as proving she can act. The visual effects are run-of-the-mill, with credits due to the filmmakers for bringing us a cool-looking monster.",0
"This is the epitome of bad 80's film-making, unless you are a pre-pubescent girl. Riding on a big name like madonna, a story line that physically assaults one's intelligence and humour that is most suited for a nursery school. If there was ever any doubt i think this turd of a movie clearly displays Madonna's absolute lack of acting talent and made me feel highly embarrassed on her behalf. The only thing i can't believe is that they ever let the director near another movie again. Madonna spends most of the movie prancing around like an infantile rag doll, and talking like a baby. It is painfully obvious that the only reason this movie was ever made was due to the fact that Madonna was a big name in pop music at the time. DO NOT BE DUPED INTO SEEING THIS AWFUL ATTEMPT TO CASH IN ON POP STARDOM. Stay away at all costs!",0
"There is only one word that describes this film: BAD!! I have no idea why this movie was even made, or how they got Dennis Hopper to star in this film. Stuart Gordon is a better director than this and Hopper is a much better actor. The film is plain stupid. I did like the ""square pigs"" idea and there was an interesting love scene involving a cyborg, other than that, avoid this film at all costs.",0
"This is the only movie that my wife and I have ever walked out on. Totally sucked. We saw it in Omaha even. Not funny at all, looks like a 14 year old kid wrote the humor. I can't believe these real politicians were actually in the movie. awful.",0
"Writer/Director Peter Greenaway cements his title as the High Lord of Art House Pretension with his latest exercise in obnoxious self-indulgence, 8 ½ Women. The film follows a wealthy Englishman and his son on their mutual quest for sexual satisfaction, as they lure and blackmail women (guess how many) into joining their personal collection of concubines.<br /><br />Think of any possible way that this premise could be offensive, and chances are Greenaway's done it. The female characters are little more than a catalogue of fetishes for the two protagonists to partake of. There's the Kabuki-obsessed Mio, the ever-pregnant Giaconda and Beryl, who's got a thing for farm animals. Giulietta has no legs and uses a wheelchair, she's the ""half woman,"" get it? Greenaway vehemently denies all accusations of misogyny, but if this isn't it, then what is?<br /><br />The film goes on to eroticize anything and everything having to do with Japan, a continuation of themes from his snore-worthy (but less sexist) 1996 film, The Pillow Book. But where the The Pillow Book was erotic and graceful, 8 ½ Women just gets horny and exploitative. Greenaway's work is tasteless and arrogant in its fetishism, and the only person likely to enjoy watching it is the auteur himself.",0
"I'm sure that any legitimate submariner would happily ship out on the USOS Seaview (yes, SOS...) Why, you could play full-court basketball in the torpedo room, it's so large. And how 'bout the bay windows in the bow, the better to see giant squids or minefields that appear out of nowhere? Did I mention the colorful mess-cook with the parrot on his shoulder? And the Admiral's stateroom with what appears to be a loft? Big bleeping sub...<br /><br />OK, OK...it's never gonna win any prizes for authenticity. And if the sub is laughable, the plot is even worse. Somehow the Van Allen belts of radiation, hundreds of miles in space, have ""caught fire"" are going to make global warming look like a weenie roast. Pompous Admiral Nelson (Walter Pidgeon), along with his sidekick Lucius (Peter Lorre, looking suitably uncomfortable) hatch a scheme to put out the fire by firing a missile into its midst.<br /><br />There's plenty of intrigue (sic) along the way, with a born-again survivor (and his little dog, too!) two ""dames"" who can never leave well enough alone, a passel of ""red shirts"" who are expendable, and plot holes big enough for Godzilla to walk through. Thrill to the Seaview being chased at what looks like 60 miles per hour by another sub -- no need for advanced sonar when you can follow from 100 feet astern.<br /><br />The movie careens from one cliff-hanger to another; the payoff is so anticlimactic as to be pointless, certainly not worth the 1 hour and 50 minute wait.<br /><br />The technical adviser for this shipwreck must have been a 14-year old boy with a stack of Popular Mechanics magazines. Worth watching, if only to riff upon.",0
"Hard to believe this was directed by Fritz Lang since he mostly directed crime dramas and mysteries. This movie has a cast that includes Robert Young, Randolph Scott, Dean Jagger and John Carradine. Scott plays an outlaw who tries to go straight and leave his old gang and winds up saving Jagger's life. Jagger works for Western Union, a telegraph company that plans to have telegraphs out west. Jagger hires a lot of men to make sure it is done because they have to worry about Indian attacks and bandits. Scott is in charge of the men and Young is a telegraph expert who can't shoot a gun but can ride. Scott meets up with his old gang who want to stop them but Scott can't tell anyone. It's a pretty good western and Lang should of directed some more westerns.",1
"This isn't ""so bad it's good""--It's ""so bad, it violates the Geneva Convention's prohibition on cruel and unusual punishment""! Only by reading the Synopsis can you even figure out the ""plot"" of this Straight to Video disaster. It's a hodge-podge of grainy stock footage spliced together with some of the all-time worst acting you'll ever have the misfortune to see. Comparing this incompetent, turgid, humorless mess to ""Dead Men Don't Wear Plaid"" is like saying that ""Gigli"" is like ""Citizen Kane"". The talentless cast are costumed in cheap, J.C. Penney ""Goin' to Church"" clothes, and there isn't the slightest attempt at period hairstyles or make-up. If you really want to see how this sort of ""homage"" can work, check out ""The Lost Skeleton of Cadavra""--It's clever, well-written, and best of all, performed by actual actors who aren't such agony to watch. For that matter, seek out the work of Phoenix artist Paul Wilson whose Sci-Fi short ""The Attack of the 70 foot Courtesy Lady"" leaves this film in the dust. The people in Terror In the Tropics look and sound like they were pulled off the street and given their scripts to read during the one and only take. This is an insult to Bela Lugosi, Boris Karloff, Lon Chaney, and anyone else involved in the films they cannibalized to make this schlock-fest! Money isn't the problem--A lot can be accomplished with very little expense. A good script, decent actors, and above Z-Grade costumes and production design should have been a given before the so-called director created this stinky pile of cinematic offal. Let's hope the ""promise"" of a sequel doesn't come true--That was by far the scariest thing shown in the whole movie!!",0
"This film was the first British teen movie to actually address the reality of the violent rock and roll society, rather than being a lucid parody of 1950s teenage life. In an attempt to celebrate the work of Liverpool's Junior Liaison Officers the opening title points out that 92% of potential delinquents, who have been dealt with under this scheme, have not committed a second crime. However, this becomes merely a pretext to the following teen-drama until the film's epilogue where we are instructed that we shouldn't feel responsible or sorry for such delinquents however mixed-up they might seem.<br /><br />Stanley Baker plays a tough detective who reluctantly takes on the post of Juvenile Liaison Officer. This hard-boiled character is a role typical of Baker. Having been currently on the trail of a notorious arsonist known as the firefly and does not relish the distraction of the transfer. However, as in all good police dramas he is led back full circle by a remarkable turn of events, back to his original investigation.<br /><br />His first case leads him to the home of two young children, Mary and Patrick Murphy (played by real-life brother and sister duo), who have committed a petty theft. Here he meets Cathie (satisfyingly portrayed by Anne Heywood) their older sister whom he eventually becomes romantically involved with. It quickly becomes obvious that the squalid environment of such inner-city estates is a breeding ground for juvenile delinquency.<br /><br />The elder brother of the Murphy family, Johnny, is the leader of a gang of rock and roll hoodlums. McCallum does an eye-catching turn as the Americanized mixed-up kid, who owes more to the likes of Marlon Brando, than any previous British star. One is reminded of Brando's character Johnny from 'The Wild One' who led a leather-clad gang of rebellious bikers in much the same way as this film's 'Johnny' leads his gang.<br /><br />Thankfully the preachiness of earlier Dearden crime dramas such as 'The Blue Lamp' is not so apparent. Instead we are presented with several well drawn-out characters on both sides of the law as the drama of the delinquents and the romantic interest between Heywood and Baker takes the forefront.<br /><br />The plot, whilst at times predictable, does deliver some memorable scenes. The disruptive influence that rock and roll music was thought to have had is played out in a scene where Johnny abandons himself to the music, leading a menacing advance on the police sergeant. The most grippingly memorable piece of film however is the climatic classroom scene where a bunch of terrified school children, including Mary and Patrick, are held hostage at gunpoint by Johnny. Obviously in the light of the real-life Dumblaine Massacre this scene seems all the horrifying. Understandably because of this the film is seldom aired or available to modern audiences.",1
"Footlight Parade is among the best of the 1930's musical comedy extravaganzas. A snappy script and an all-star cast including Jimmy Cagney, the lovely Joan Blondell, Dick Powell, and Ruby Keeler make this film a cut above the rest. Directed and choreographed by the creative genius Busby Berkeley, this film will have you grinning from ear-to-ear from start to finish.<br /><br />Busby, of course, is the undisputed master of the Hollywood musical with ""Gold Diggers of 1933"" and ""42nd Street"" to his credit (as Dance Director). Footlight Parade is graced by hundreds of scantily-clad chorus girls, a Berkeley trademark. The elaborate dance numbers were shot with only one camera and Busby was the first director to film close-ups of the dancers. His obsession with shapely legs and ""rear-view"" shots is amply demonstrated here. The overall effect is highly erotic and mesmerizing.<br /><br />Our boy Jimmy Cagney plays Chester Kent, a producer of ""prologues"" or short musical stage productions that were performed in movie theaters to entertain the audience before the talkies were shown. He's surrounded by crooked partners, a corporate spy, and a gold-digging girlfriend. Although Cagney had a solid background in vaudeville, this was the first film in which he showed his dancing talents. Joan Blondell is memorable as Cagney's wise-cracking, lovestruck secretary. And Ruby Keeler is adorable, as always.<br /><br />The film climaxes with three outstanding production numbers, ""Honeymoon Hotel"", ""The Waterfall"", and ""Shanghai Lil"", each one a masterpiece and not likely to be duplicated in today's Hollywood where so-called ""special effects"" have replaced creative cinematography.<br /><br />Claudia's Bottom Line: Clever and erotic, with some of the best musical production numbers ever put on celluloid. A thoroughly enjoyable Depression era romp.",1
"I'm sorry to see that it has been rated that low by many people. The series started off very good and after the first season it wasn't that good.<br /><br />People tend to forget the beginning of something and only look at the end. This is not good to do, you should look at the total, not the end result. It is sad that a lot of the ""usual"" characters died but, damn, we had a lot of nice NEW characters.<br /><br />Please do not attach yourself to a few characters but attach yourself to the series, the plot. Please do understand that I didn't like it when Boone died, when Augur died but well... it needs to be done. Can you imagine that everyone keeps living the whole series when they are in a lot of danger all the time? Come on, face it, if they didn't die they would be invincible. In this way you will always keep the tension, will he survive, will he die? I do realize that people attach their selves to characters, I do that too. My favorite character was Augur, the one who could get into every computer he wanted. He was the one who was mysterious, he could do things with the computer no one else could do.<br /><br />I wish to make one statement to all the people who vote negative, does a series which started so good deserve to have such low rating? Should we look at the final season instead of the total? Should we not see how good the series was when it started? Should we not see how much we enjoyed it?",1
"I believe an entire book can be written about the odyssey to remake the classic film on which this film is loosely based. When Hollywood first started talking about such enterprise, the reaction was always negative because there were just too many aspects that could have gone wrong, starting with the solid ensemble that made the original unforgettable, and that's exactly where things begin souring here, with the selection of actresses that otherwise can do remarkable work, but that are not suited to the parts, and sadly enough, have been directed with the heavy hand of a director that doesn't understand or appreciate the source material.<br /><br />It seems as if there is no focus or direction, or as if the direction that has been taken is to obliterate anything that was good about the original film. This is called an updating, as in let's drain the story out of humor, snappy dialogue, and any interesting premise. Most of all, let's prove that women have come a long way, except that the problem is that we don't really get (at least by watching this film) where the women are truly going.<br /><br />For starters, casting Meg Ryan in the central role proves almost fatal to the movie because somehow she seems to have locked herself into some sort of limbo where women don't really change appearances, even after 20 years of working in the movies. Her Mary which proved to be a difficult role in the 30's, somehow grew from her interaction with the other stereotypes, like Dorothy in ""The Wizard of Oz"" by learning, observing, and realizing that she had a choice in the matter. It might not have been a choice that women would celebrate nowadays, but it was fun ride, and part of the fun, was the catty, silly, sometimes slapstick routines that elevated that movie into the realm of the sublime. In here, we are down to earth with a thud. By changing the nature of Sylvia, the film has lost a lot of its spark, and it isn't in anyway Annette Bening's fault. I couldn't help but admiring how she tried to save this sinking ship and got a sinking feeling as she struggled with the horrible lines she was handled. Thankfully I entertained myself by looking at some of her terrific outfits and kept reminding myself how talented this lady really was. Her Sylvia is wise but flawed, and she could have been a great creation. Unfortunately Ms. English wasn't paying attention to her own work and loses control of the one character that could have turned the film into a fresh direction.<br /><br />Yet that wasn't the biggest blasphemy of them all. In the original, we have Joan Crawford doing probably one of the best performances by a woman. Her Crystal is legendary, with conniving lines, incendiary moves, duplicitous maneuvers, and some very sexy poses. She was the link between the male and the female, and through her we knew what the whole catastrophe was about. She provided the tension between men and women. She was dangerous, sexy, the ultimate femme fatale. A woman of intelligence that we feared and admired, and most importantly, we wanted to destroy to save our heroine. Eva Mendes, as gorgeous as she is, is two dimensional in this outing because of weak writing, and once again, some bad casting.<br /><br />There are more atrocities in the film, such as the addition of a terrible role for Mensing as the dedicated mother who lives for having babies, and the rather annoying lesbian turn by Pinkett. Then comes the biggest waste of talent in the movie, as Bette Middler, who is a little unrecognizable in her make up, shows the spark of what could have been. Her acidic delivery reminds us of the contemporary angle the film could have taken. Her words revive and put a big of much needed naughtiness in the film, and it is exciting to see that it could really fly, then she is gone. She is in the film all of six minutes, and she fades away in the middle of the muddle.<br /><br />Here is a movie that raised our anticipation level and truly disappointed us, a film that could have joined the successful ""Sex in the City"" who made an amazing transition to the big screen because it respected its source material and didn't compromise. It gave us more, bigger and better adaptation. It truly updated what had made it successful before. ""The Women"" in its present reincarnation needs to go back and rework itself, much like ""The Hulk"" did it this year, find more suitable performers, a really good writer, and most of all, someone who truly treasures what good movies are about.",0
"I really wanted to like The Pillow Book. Intriguing story, interesting character outlines, Ewan Macgregor in the utterly glorious altogether. Unfortunately, I hated every minute of it. Greenaway got so enamoured with presenting the movie uniquely, and not to the film's benefit. I won't even get into Vivian Wu's abysmal acting.<br /><br />You get distracted from the story with 4 billion teeny windows and calligraphy that rolls on the bottom of the screen displaying the lyrics of the music that's playing. It seems he lost sight of presenting the actual story and developing the plot, and got entangled with foo-foo embellishments that have nothing to do with anything. It's a bit like presenting a John Singer Sargeant portrait in a chintzy Hallmark frame that says ""GRANDMA LOVES ME!"" in big sparkly letters.<br /><br />This movie seems to be a casualty of the director auteur's ego instead of what it could have been - disturbingly and horrifyingly beautiful. In another director's hands (Jeunet? Coppola?), it could have been a masterpiece. In Greenaway's hands, it's best relegated to fine arts classes that also take themselves too seriously.",0
"Footprints is a very interesting movie that is somewhat difficult to categorize. ""Psychological thriller"" is the most appropriate description I can think of. The female protagonist, Alice Cespi, discovers that she doesn't remember anything of the last three days. The only clue she has is a torn photo of a hotel. She is also haunted by a recurring, very vivid, dream about a science fiction movie that she believes she saw many years ago. In her pursuit of the truth behind her amnesia she doesn't trust anyone, but little by little it becomes obvious that she has visited the town where the hotel is located before. This is an exciting flick whose main virtue is that it is virtually impossible to predict how the events will unfold, and particularly, how it will end. The unusual loneliness of the main character and the unreliability of everyone else ensure that the good old paranoid feeling is present throughout the film, whereas beautiful colors and some spectacularly filmed sequences make this a visually attractive movie as well. The important part of the one and only Nicoletta Elmi, everyone's all time favorite redheaded obnoxious child star of Italian horror, is an extra bonus.",1
"I was really disappointed by this movie. Great actors in it, and potentially a great plot, but it just seemed to limp along.<br /><br />Charlize Theron was masterful in her role and beautiful, but it seemed like 90% of her on-screen work was in car chases done with Austin Minis. Product placement gone wrong, so very wrong.<br /><br />The direction seemed off, too. Edward Norton is the bad guy, and it was so obvious right from the start. Every time the camera would pass over him, it would linger too long and Norton would grimace or something. C'mon, Hollywood, give us a little credit! It's okay to surprise us with a plot twist without having to telegraph it.<br /><br />Sorry, but this movie was just below average. I have always been one to appreciate the work and talent that goes into a movie, but this one just didn't have it.",0
I can't get over how lazy the director is with this movie. Instead of setting up scenes in a creative way he relies on boring old zombie clichés.<br /><br />Where the two unarmed leads have to get down the college steps into the van he surrounds them with zombies yet neither of the leads is bitten. He can't be bothered to direct a decent fight scene so we see the leads shove their way down the steps.<br /><br />Sometimes the zombies limp about and at others they run like the wind. This is really convenient for the director because he can set up anything he likes without bothering with continuity in the behaviour of the zombies.<br /><br />With careful planning and a lot more inspiration this movie could have been so much better.,0
