review,sentiment
"I was excited to discover this late sixties comedy staring some of my favorite people - Maggie Smith, a very young Bob Newhart and, of course, Peter Ustinov. My disappointment was thus compounded to discover the film doesn't work as either a comedy or a perfect heist film. Ustinov plays a small time crook just out of prison who sets his sites on a large American corporation based in London. Bluffing his way past dimwitted CEO Karl Malden and tech geek Newhart, Ustinov passes himself off as a computer expert and immediately plans the 'perfect heist' part of the film. To do this he needs to get passed a tamper proof security system that guards the corporation mainframe. And here is problem one. His perfect plan only works because everyone else in the film is remarkably trusting and stupid. His lame excuses are taken at face value and this must be the only computer center anywhere not to bother with video cameras. The second problem is the heist (fraud really) happens within the first 30 minutes of the film robbing the rest of the picture of much in way of dramatic tension. Maggie Smith is sadly miscast as Ustinov's ditsy next door neighbor/secretary who just can't keep a job. I love Maggie Smith but she just seems too together here, too composed, the part called for more of a wacky, physical comedian. Furthermore, Ustinov and Smith have no chemistry together, maybe it's the age difference, but the later romantic relationship, as devoid of actual romance as it is, still comes off a little creepy. Ustinov co-wrote the script, and it was thought well of at the time, but I found it unfunny, meandering and a sad waste of a great cast.",0
"I enjoyed every moment of this beautiful film and was intrigued about this female painter I had never heard of before. So I set out exploring her life and work afterwards. As could be expected, I found out that the film was not exactly historically accurate. I was a little astounded however by the very negative comments on the film because of this inaccuracy. Come on, guys, a film isn't and shouldn't be a biography (nor a novel!). Any historical film distorts reality, because it should be a work of art in its own right. A film director is fully entitled to use elements from reality and history to create a world of his own. Artemisia is a wonderful film and I think it brought many people (including some that now give negative comments) to explore the life and work of this fascinating artist.",1
"(Caution: several spoilers)<br /><br />Someday, somewhere, there's going to be a post-apocalyptic movie made that doesn't stink. Unfortunately, THE POSTMAN is not that movie, though I have to give it credit for trying.<br /><br />Kevin Costner plays somebody credited only as ""the Postman."" He's not actually a postman, just a wanderer with a mule in the wasteland of a western America devastated by some unspecified catastrophe. He trades with isolated villages by performing Shakespeare. Suddenly a pack of bandits called the Holnists, the self-declared warlords of the West, descend upon a village that Costner's visiting, and their evil leader Gen. Bethlehem (Will Patton) drafts Costner. After much misery and numerous efforts to break Costner's spirit, he escapes, thus ending a lengthy section of the movie that could have been told better in a three-minute flashback.<br /><br />We now finally get to the major premise: the escaped Costner finds an abandoned mail truck and delivers the letters to the nearest town, hoping to get some food under pretense of being a postman. A number of the village people led by young Ford (Larenz Tate) want to get in on this postman act, which does not sit well with Bethlehem and his bandits, and Costner finds himself the unwitting and unwilling leader of a band of postmen at war with the Holnists.<br /><br />The idea of The Postmen versus The Bad Guys is not as ridiculous as it sounds. The Holnists depend for their livelihood on the fact that the villages they prey on are isolated from one another; the Holnists can destroy any one village, but could not stand against all their victims united. To unite, the villages must communicate with one another, and a working mail system would thus be a big step toward putting the Holnists out of business. So it really makes a lot of sense that Bethlehem would get medieval on our heroic mail carriers. Unfortunately, Bethlehem's eventual defeat is not the result of the villages uniting against him, but instead your old standby cliche, the one-on-one brawl between him and Costner. Nor is there even any real attempt by the communities to use the mail to work together to solve their problems; all the mail seems to be the standard ""Hi, Aunt Debbie"" stuff played for maximum sentimental value.<br /><br />THE POSTMAN is one of the most predictable movies, shot for shot, that I have ever seen. Now, I don't purposely try to ruin movies for myself by straining to figure out what's going to happen next. But here we're talking about the kind of predictability that requires no effort; I just knew what was going to happen next whether or not I wanted to know. After a lion is prominently showcased eating people, a Holnist bandit seeking the escaped Costner ventures into the bushes after a noise, and we are then ""shocked"" when the lion eats him. A bunch of unoffending villagers are rounded up and shot by a firing squad, and one of the villagers sings out some Famous Last Words right before being shot, to my immense lack of surprise. A covered statue is unveiled to show exactly what everyone knew was going to be there: Costner bending to pick up a letter from a cutesy kid we saw earlier in the movie. A man tells Bethlehem that no sir, you can't just take my wife; Bethlehem runs the unsuspecting sod through, though he is the only person in the theater who is unsuspecting.<br /><br />But it is rank, cloying sentimentality that really undoes THE POSTMAN. Olivia Williams, playing Costner's lover Abby, is worst served. She pours her heart into the material and gives her very best effort to make it sound natural and sincere. She tries so hard, it's heart-breaking. But nobody could ever have made the lines ""I have a gift for you, Postman . . . You give out hope like it's candy in your pocket"" sound like anything but the syrupy pap that they are. Another example is the scene where a mounted Costner thunders past a little boy, ignoring his proffered letter, only to turn around, stare at him for what seems like five minutes, and then thunder back to pick up the letter. Why didn't Costner just pick it up the first time? No real reason; it's just an artifice that tries and fails to give us a feeling of elation by dashing the kid's hopes and then restoring them.<br /><br />Schmaltz and predictability unite at the end as the statue of the Postman is revealed. I sat thinking, ""Please don't tell me they're going to show the statue and then cut back to the scene with the cutesy kid. Surely that is too saccharine, too obvious for even this movie."" Then, alas, the music swelled and we did indeed cut back to the dreaded little boy smiling as his letter to his maiden aunt is whisked away, and I held my head in my hands and thought, ""Somebody shoot me."" It felt like having thirty pounds of apple pie rammed down my throat.<br /><br />Gen. Bethlehem is a more humanized villain than normal. Your standard-issue post-apocalyptic villain is the meanest, toughest S.O.B. in the valley. Bethlehem is shown to be a little nothing of a man inside, who tries to make himself feel important by beating up on others. Although some menace is thereby sacrificed, Bethlehem is credible in a way most villains aren't. Unfortunately, Will Patton overacts. And although we are told early on that Bethlehem utterly destroyed his last challenger in five seconds of hand-to-hand combat, Bethlehem's actual fighting skills shown at the end of the movie are absolutely ludicrous.<br /><br />The acting is otherwise pretty good. Costner has done better, but his Razzie was an overreaction. As mentioned, Olivia Williams is very impressive. Larenz Tate as Ford does a sincere and credible job. James Newton Howard's score is competent, though short of the epic standards the movie was going for. But it's not enough to save this film.<br /><br />Rating: *1/2 out of ****.",0
"I love Sarah Waters's Fingersmith, and was worried about the TV adaptation as I'd been disappointed by the BBC's version of Tipping the Velvet (which although beautiful to look at was let down by Keeley Hawes not being able to sing, and Rachael Stirling not being able to act). Fingersmith is a very tightly plotted novel with breath taking twists and turns and I wondered if this could be done justice to in just 3 hours.<br /><br />I needn't have worried. The adaptation was excellent, very little cut out, and went along at a cracking pace (although I did wonder whether if you hadn't read the book, would you miss things?). It had the look and feel of a BBC classic costume drama and i kept having to remind myself that this is a contemporary book.<br /><br />The acting was stellar. Sally Hawkins acting her heart out as Sue Trinder, and Elaine Cassidy, a slow burner, who by the end of the story was incandescent as Maud Lilley. The love, the passion, the realisation of the acts of betrayal both would have to perform, were written on their faces. It was a joy to watch.<br /><br />I hope Rachael Stirling was watching: that's how you play a Sarah Waters character!",1
"In Frank Sinatra's first three films, he was purely a speciality act: ostensibly playing himself, he merely shows up to croon a song during a nightclub sequence in somebody else's movie. In his fourth film, the very enjoyable 'Higher and Higher', Young Blue Eyes transitions into an acting career by playing an actual role ... a task made easier because he's playing himself in a fictional story that gives him a chance to croon a few numbers.<br /><br />Sinatra's entrance is quite funny. Michele Morgan hears a knock at the door, and asks who's there. From outside, a Hoboken-toned voice answers 'Frank Sinatra'. Sure enough...<br /><br />The opening credits of 'Higher and Higher' may confuse some viewers, as the names of songwriters Rodgers and Hart are prominently displayed. In fact, they only contributed one song to this musical: 'Disgustingly Rich', which this cast manage to toss off as a sort of intro to an entirely different song, 'I'm a Debutante'. Interestingly, that Rodgers & Hart song -- one of their weakest -- is perhaps the least enjoyable song in this movie's score; several others are lively up-tempo numbers, notably 'It's a Most Important Affair', 'When It Comes to Love, You're On Your Own' and 'I Saw You First'.<br /><br />Sinatra's good in this movie, but he would do better work (and sing better material) elsewhere. The real merits of 'Higher and Higher' are the delightful turns by some performers who rarely made films. Paul and Grace Hartman were an extremely popular husband-wife dance team who starred in several Broadway revues: genuinely graceful ballroom dancers, they put plenty of physical comedy into their dance material. (Here, Grace does a high kick that knocks a shoe out of Paul's hands.) Grace Hartman, who died of cancer at age 48, did almost no film work, so it's a real pleasure that this film gives us a rare chance to see her close-up, to hear her beautiful singing voice and to notice how sexy she looks in her maid's uniform. After Grace Hartman's death, her husband had a long career as a character actor, just occasionally dancing solo. (Or alongside Ken Berry in one memorable episode of 'Mayberry RFD'.)<br /><br />Also quite attractive in a maid's uniform here in 'Higher and Higher' is the vivacious teenage singer Marcy McGuire. Why didn't this talented girl make more movies? Perhaps she was just a bit too similar in personality to Betty Hutton. I enjoy Hutton's performances but I like Marcy McGuire even better. Near the end of 'Higher and Higher' there's an amusing bit of physical business featuring McGuire and Mary Wickes as waitresses, taking it in turns to move from table to table in a nightclub. The alternating strides of short McGuire and tall gawky Wickes are hilarious! Regrettably, although Leon Errol plays a large role in 'Higher and Higher', he is given almost no comedy business: not once does he do his famous rubber-legged dance. Jack Haley, despite his prominent billing, is also wasted.<br /><br />Very well-represented here is Dooley Wilson, inevitably remembered as Sam from 'Casablanca'. In that film, Wilson did his own singing but faked his keyboard performance of 'As Time Goes By'. (In real life, Wilson couldn't play piano.) Here in 'Higher and Higher', he sings pleasingly and gives some amusing reactions to the other players. Less enjoyable is Mel Odious, I mean Mel Torme. Victor Borge gives a rare film performance here, handling his dialogue deftly but never doing any of the keyboard comedy which he later did successfully in his stage shows.<br /><br />The plot? Forget it. 'Higher and Higher' is nobody's idea of a 'great' musical, but it's an enjoyable delight, and I'll rate it 8 out of 10. Director Tim Whelan, who worked in Britain as well as in Hollywood, deserves to be much better known.",1
"With all this stuff going down at the moment with MJ i've started listening to his music, watching the odd documentary here and there, watched The Wiz and watched Moonwalker again. Maybe i just want to get a certain insight into this guy who i thought was really cool in the eighties just to maybe make up my mind whether he is guilty or innocent. Moonwalker is part biography, part feature film which i remember going to see at the cinema when it was originally released. Some of it has subtle messages about MJ's feeling towards the press and also the obvious message of drugs are bad m'kay.<br /><br />Visually impressive but of course this is all about Michael Jackson so unless you remotely like MJ in anyway then you are going to hate this and find it boring. Some may call MJ an egotist for consenting to the making of this movie BUT MJ and most of his fans would say that he made it for the fans which if true is really nice of him.<br /><br />The actual feature film bit when it finally starts is only on for 20 minutes or so excluding the Smooth Criminal sequence and Joe Pesci is convincing as a psychopathic all powerful drug lord. Why he wants MJ dead so bad is beyond me. Because MJ overheard his plans? Nah, Joe Pesci's character ranted that he wanted people to know it is he who is supplying drugs etc so i dunno, maybe he just hates MJ's music.<br /><br />Lots of cool things in this like MJ turning into a car and a robot and the whole Speed Demon sequence. Also, the director must have had the patience of a saint when it came to filming the kiddy Bad sequence as usually directors hate working with one kid let alone a whole bunch of them performing a complex dance scene.<br /><br />Bottom line, this movie is for people who like MJ on one level or another (which i think is most people). If not, then stay away. It does try and give off a wholesome message and ironically MJ's bestest buddy in this movie is a girl! Michael Jackson is truly one of the most talented people ever to grace this planet but is he guilty? Well, with all the attention i've gave this subject....hmmm well i don't know because people can be different behind closed doors, i know this for a fact. He is either an extremely nice but stupid guy or one of the most sickest liars. I hope he is not the latter.",1
"Dean Koontz's book ""Watchers"" is one of the finest books I have read. Sadly, the movie is a sad caricature of the book. The disillusioned middle-aged hero and the lonely spinster with whom he finds a meaning to his life are converted in the movie into a couple of silly teenagers, the stoic security agent and the conscientious sheriff are combined into a farcical villain - you get the picture? The moviemakers have taken a moving tale of love, horror and adventure and converted it into a Z-Grade horror flick aimed - very poorly - at the teen market.<br /><br />Buy the book and enjoy many hours of reading - it will be far, far more rewarding than watching the movie.<br /><br />",0
"The numbers don't lie, 109 people have voted for this film. That says a great deal about the standing of one of the most intuitively insightful comedians of the late 20th century. And for those of you who know the work of Bill Hicks, if he were alive today, imagine what he would have to say about the boy president from his home state? That his short career remains unrecognized is a sad situation and this film, or rather these two films explain why. First, you see how his talent was obvious from the start, again and again, those who knew Bill Hicks always say he was not only funny, he was also unique. The film also shows how the quality of his material was too challenging for many in the entertainment industry. His drinking also contributed to his career problems, but that is less evident in this film. And then the second film is a complete performance. If you have never seen or heard Bill Hicks, this is a wonderful introduction to the person and his dark but intelligent humor. Especially due to the fact that the topics are now almost 14 years old, yet remain ironically up to date is underlined by the fact that many of the events took place under the first President Bush.<br /><br />Watching them together - first the biography and then the performance - makes you aware of how greatly talented this young man was, how quickly his life passed and how the American media can sometimes act as the great big homogenizer. Let's make sure nothing is too provocative, nothing will be too interesting And the result? Well, as the man himself said, go to sleep America, your government is in control........... In his lifetime, at least in Great Britian this artist was recognized for his talent and was successful there. 11 years after his death, 109 people at IMDb can say something about the film. After you've seen them both, I hope you understand why more people should be listening to Bill Hicks.",1
"Brian Keith as Cole Wlikerson and Richard Jaeckel as Wade Matlock make excellent villains. They just love intimidating the locals in the most brutal way possible, and sneer sexily at any suggestion that there might be a more humane way to achieve their ends. It's a pity that goody-goody Glenn Ford gets in their way.",1
"That is what this movie is. Good God the special effects suck in this movie. It is difficult for anything to suck more than this movie's plot, but the special effects manage to pull it off. Let me try to explain just how bad this movie is.<br /><br />First, there is the plot. There are four punk-ass teenage dirt bikers who are riding around in a forest in Duluth, MN. One of them is a dumb-ass and tries a ridiculous jump and breaks his leg. A paramedic comes to help him, but gets stranded with them when the helicopter breaks. Then all five realize that there is a forest fire, which we see is started by some guy dumping tons of gas all over the forest. All they show us is his boots, and they show scene after scene of this guys boots walking around dumping gas and starting fires. Meanwhile, the teenagers try to escape the fire, only to find that boot man has somehow managed to get ahead of them (while they were speeding through the forest on dirt bikes!), dump gas all over the area they were riding through, and start more fires. He does this several times, and the paramedic finally catches him and starts him on fire. I won't spoil the ending, but this guy's resilience will have you shouting ""WHAT THE BLOODY HELL?!?!"" at the screen. Anyway, they are now surrounded by fire, and their only escape is through a mine which is filled with methane gas. Yes, methane gas. I'm not even going to try to describe the ending, because it is too ridiculous, and you'll enjoy it more if you don't see it coming. Which you won't, because you can't possibly expect what happens. This is because of the second major problem with this movie: consistency.<br /><br />Is some semblance of consistence too much to ask for? Apparently so. I cannot even count the number of broken limbs in this movie (they keep breaking arms and legs while crashing their bikes). I think each character breaks at least one limb, and several more than one. They then limp around until the scene ends, and then forget that they're supposed to have broken limbs. There is one scene where three of them who are supposed to have broken legs start dancing. But then their injuries suddenly return when the plot needs them to.<br /><br />Finally, the CGI. If there is a hell, it consists of watching the fire in this movie. All they did for the forest fires is line the dirt paths with CGI fire. You can clearly see that the only CGI fire is along the paths, and all of the trees more than two feet from the path are left untouched. And then they zoom out and show the whole forest being engulfed in flames. It's hard to describe in words how ridiculous it looks, but I assure you that the ridiculousness is quite impressive.<br /><br />This movie is one of those so-bad-its-good types. There are some occasions where it descends into the painful-bad category, but for the most part it stays above the line and is laughably inept. I can't wait to check out the other Nature Unleashed movies that came in the four-pack with this one.",0
"1st watched 5/17/2002 - 3 out of 10(Dir-Ewald Andre Dupont): Fairly lame account of the Titanic disaster is the first filmed version of this much-heralded event. The replication of the disaster is not bad, but the drama around it is at some times silly, badly acted and way-too soap opera-like. The story is very much the same as the most recent Oscar-winning one except that we are shown how the crew tried to hide the actual disaster that was occurring until almost too late. Good for nostalgia purposes only and to get a feel for what James Cameron was competing against(barely) in his recreation.",0
"I can't believe that anyone would green light this let alone voluntarily star in it. I will never be able to get that 90 mins of my life back.<br /><br />This has to be one of the worst films I have ever seen. Some films are so bad they're good. This has gone so far round again that's somehow it's so bad it's terrible. I was not exactly expecting much, it being a low budget, bandwagon jumping, rehash of a B Movie, but it still came in way under my expectation levels. Even TV movies have higher production values.<br /><br />There were (very) poor special effects, shocking dialogue, terrible acting and a completely unexplained plot. Who cursed her and why, why did the 6 inch snakes turn into 15 foot snakes, has anyone ever heard of highly venomous garter snakes or pythons? 100 passengers? 3,000 snakes? So many promises, none delivered. <br /><br />Some comments would have you believe that this film is worth watching for the last five minutes. It's not even worth a rental. Stay in and watch a low budget TV movie, you'll enjoy it a lot more. <br /><br />Why was this made? Oh yes, to shamelessly cash in on the internet phenomenon that is SOAP. Shame on you Mallachi Brothers, shame on you",0
"Bottom-of-the-barrel stinker is so bad it's beyond funny. The ""plot"" is about an American mercenary, played by Reb Brown (in the film he's called a ""military adviser"" but it's not really clear if he's in the American military or not), helping the army of a Latin-American country fight guerrillas who winds up joining the guerrillas when the government turns on him, imprisons and tortures him. Shannon Tweed is a ""sports equipment saleswoman"" he picks up in a bar who gets caught up in all the intrigue. That description actually makes the movie sound better than it is, because it's really a stinker of almost Biblical proportions. How bad is it? Well, Shannon Tweed turns in the movie's most professional acting job. If that isn't an indication of just what a 12th-rate piece of junk this turkey is, nothing is From mismatched sound effects to a music score that sounds like it's from a 1940s ""Z""-grade horror flick (and may very well be) to the same footage (i.e., armored personnel carriers going down the same jungle trail) reused constantly to some of the most ineptly staged ""action"" scenes in recent memory, this laugh-a-minute sludgefest has to be seen to be disbelieved. Tweed looks bored, Brown looks hung over, and by the time this thing is finished--if you can last that long; I couldn't--you'll know just how they feel.<br /><br />Although there are a lot of explosions and gunfights, this can't be considered an ""action"" picture by any stretch of the imagination. It's boring (there's a scene in the back of a truck where everybody just stares at each other for three or four minutes), repetitive (the same ""rebels"" and ""soldiers"" being killed over and over), illogical (when a group of rebels is caught in an open field by a government helicopter gunship, instead of breaking for cover they just stand there staring up at it), inept (soldiers and rebels falling ""dead"" when no gunshots are heard, a gun battle inside a house where combatants standing against walls are machine-gunned but miraculously the walls escape undamaged) predictable (when the ""Governor"" says to offer a reward for Brown's capture because ""someone"" might turn him in, you know exactly who that ""someone"" will be, and it turns out to be exactly who you thought it was) and just downright stupid (pretty much everything else in the picture). Inept, brainless and stupid beyond belief. Don't waste your time.",0
