review,sentiment
"When HULK hit theaters in 2003, it wasn't long before DVDs of the old Incredible Hulk TV show popped up in an attempt to cash in on the craze. We saw a similar occurrence a year prior when Spider-Man cartoons appeared on DVD to coincide with that hero's big screen debut. Companies leap at the opportunity to ride on the financial coattails of a hot brand.<br /><br />So the fact that this picture never surfaced on the shelves of Wal-Mart as its featured heroes clobbered the box office in the summer of 2005 says a lot. I guess everyone involved would just rather forget. To be fair, THE FANTASTIC FOUR is not as bad as everyone says. Let me rephrase that. It's not as unentertaining as all of its negative reviews might suggest.<br /><br />Veteran television actor Alex Hyde-White (no, you don't remember any of his roles) leads the way as Reed Richards, the brilliant scientist who, along with his crew, gains bizarre powers after an outer space mishap. He's left with the ability to stretch and contort his body to outrageous lengths. His future wife, Sue Storm (Rebecca Staab), can suddenly turn invisible, while her brother, Johnny (Jay Underwood), may now ignite himself at will. Then there's poor Ben Grimm (Michael Bailey Smith), the lovable lug whose body morphs into a mass of craggy, orange rock.<br /><br />Just as the friends are becoming accustomed to all of this, they are called upon to rescue the world from certain chaos. It seems Reed's old colleague Victor von Doom (Joseph Culp) is living up to his name, and that villainous Jeweler (Ian Trigger) isn't exactly helping old ladies cross the street, either. Can our heroes save the day? Of course they can; like any superhero movie, it's just a question of how and when.<br /><br />What's striking about THE FANTASTIC FOUR is how amateurish it is in virtually every aspect. The dialog is so lame and tired it sounds like it was written by a junior high drama class. The acting is so unpolished it makes a third-rate afternoon soap opera look like Shakespeare. The special effects are surprisingly good considering the minuscule budget, but there are still some positively embarrassing moments. When The Human Torch fully ignites his body, for instance, the entire movie briefly turns into a cartoon. I can just hear that production meeting. ""Oh, no one will notice. They'll be too intrigued by the action!"" I mean really, a cartoon? At least give me a mannequin on fire held up by a string! Prior to that, the scene in which the foursome come to on earth after their spaceship crashes is pure teens-in-the-backyard fare. The crew simply found a field and lit a vaguely-spaceship-like object on fire. That's the only remnant of such a major disaster?<br /><br />Of course there wasn't a whole lot to work with in the script. There is a fairly coherent story here, but it's all so simplified. When Reed and Ben decide to go into outer space, they simply drop by the Storms' house and ask if they'd care to join them. Is it really that easy? Don't these sort of things require, oh, I don't know, years of training and expertise? Not in the world of these writers, who seemed to be inspired by the underrated genius on display in FULL HOUSE reruns. But as bad as that may be, nothing can compare to how painfully clichéd Dr. Doom is. He was pulled right out of those awful superhero cartoons from the 1960s, right down to the evil laugh and slamming his clenched fist down on the table to punctuate his remarks. No comic book, least of all Fantastic Four, has ever featured a villain so obscenely one dimensional.<br /><br />Ultimately, THE FANTASTIC FOUR is saved from being a complete turkey because it's just so damn innocent. You can tell the people involved, as little talent or experience as they had, really tried. They didn't know the final result would be so embarrassing. They were under the impression that this was their big break, that people would flock to the theaters. It bears repeating that they had virtually no money to work with (and I'm sure half of that was eaten up by the cool Thing costume). All things considered, they did well, and for its many flaws, the finished product is a fair amount of fun for comic book fans.",0
"This movie was by far the worst movie I've ever had to endure. I couldn't believe that they tried to pass it off as a serious movie, it was so bad I couldn't even laugh at it's pathetic attempt to entertain me. If you want cheesy horror that you can laugh at, rent Dr. Giggles instead.",0
"""Don't be greedy"" sums up the depth of this movie. All the rest of the baloney is big budget window dressing. The movie rotates through hiding the ball annoyingly and revealing too much. None of the potentially interesting plot tangents are developed yet the trite ones are hashed and rehashed to excess.<br /><br />The charm of DD, as others have pointed out, was in the schizophrenia device,the humor woven into the fabric of the movie, and most importantly, the acting. There is enough wooden acting in The Box to attract a giant mound of martian termites.<br /><br />The biggest problem with suspending disbelief during this mess is the glaring question, ""why would a technologically superior power capable of taking over the government need to do any testing at all?"" Awful failure of a movie.",0
"The US appear to run the UK police who all run around armed to the teeth and did you know that CID officers change into uniform when they stop work and go down the pub! This has got to be one of the most unrealistic films with the worst portrayal of ""real"" UK police that has ever been foisted on the unsuspecting public. I can see that Mr Snipes might have needed the money to pay his back tax bill but what the heck a good actor like Charles Dance was doing in it is a mystery.<br /><br />Worse than the worse low budget ""B"" film of the 50's. An hour and a half of suicide and time I will never get back.<br /><br />Avoid it like the veritable plague.",0
"I was excited at the concept of my favorite comic book hero being on television... and sorely disappointed at the end result.<br /><br />The only ""amazing"" thing was the wall crawling (despite the visibility of the cable). I didn't think Nick Hammond was Peter Parker... and he was visibly of a different build than the guy who did the stunts in the spider suit. You could tell they were two different actors.<br /><br />Granted, I can also spot in the modern Spider-Man movies when I am looking at Tobey Macguire and when I am looking at CGI. But that is from a trained eye and experience working with CGI. Still, the 70's version could have been better despite lack of Special FX.<br /><br />The webs were hokey and looked like ropes that seemed to wrap around things rather than stick to them. And what was up with giving him a spider mobile to ride around in. Hello? He's the web slinger people.<br /><br />Sorry... didn't mean to get so worked up, but our beloved wall crawler deserved better.",0
"I came out of ""Rendition"" with a list of flaws a mile long, so how is it that my overall impression is that it was a pretty decent movie? It's definitely a film whose sum is better than its parts.<br /><br />Those parts include a cast of big name stars, not one of them giving a memorable performance (Omar Metwally, a relative unknown, is the one you'll remember); serviceable if undistinguished direction; and a screenplay that's both too complicated and too simplistic at the same time. Metwally is an Egyptian-born American citizen who gets kidnapped by the U.S. government's rendition program, otherwise known as the process by which America tortures suspected terrorists into confessing information whether or not it's remotely true. Reese Witherspoon plays his pregnant wife, who calls in the favor of an old college friend (Peter Saarsgard), who works for a senator (Alan Arkin) and helps to track her husband down. Meryl Streep plays the head of the rendition program; Jake Gyllenhaal is a young agent assigned to the interrogation and whose conscience gets in the way. Meanwhile, a whole parallel storyline follows the daughter of a top Egyptian official who is allied to the American rendition program and her boyfriend, who's in training to become a suicide bomber.<br /><br />Ay-yi-yi that's a lot of plot to pack into a two-hour movie, and I was about to wash my hands of the whole thing, especially the Egyptian Romeo and Juliet subplot that felt like nothing more than a distraction. But then near the film's finale, a twist of chronology brings all of the plot strands together in a way that makes you want to reassess everything you thought you knew about the motivations of the various characters, and makes ""Rendition"" a much more interesting movie than it seems like it's going to be.<br /><br />Witherspoon, Gyllenhaal and Sarsgaard all look like high school students playing adults twenty years older than they actually are -- Gyllenhaal in particular, usually a fine actor, looks so bored that you wonder if he's going to muster the energy to deliver his lines. And the screenwriter should be arrested for having an actress as good as Meryl Streep at his disposal and giving her nothing more to work with than this one-dimensional dragon lady. The movie of course strives for relevancy, but instead of addressing the tangled web of arguments surrounding the national security issue, it charges right down the middle of the debate in a predictable fashion. There are moments when you think maybe the film will veer off in an interesting direction -- what if Witherspoon did actually begin to doubt her husband's past, for instance? What if Metwally actually had been in contact with terrorists, as his interrogators accuse? But no, the movie takes the path of least resistance.<br /><br />But, like I said upfront, I recommend this movie. I know I've done nothing but list a bunch of its faults, but it's got its head in the right place, and it is entertaining, or at least as as entertaining as a movie about torture and interrogation can be.<br /><br />Grade: B+",1
"Okay, I grew up on Who, but haven't loved a Doctor since Tom Baker. Christopher Eccleston made me love Who again and I'll be furious with him forever for leaving. <br /><br />The writing is grand, the acting superb, the directing (which was dreadful in the old days) is just fantastic. I was very skeptical about this programme, and watched it merely out of being forced, but am now a huge fan and love it (I have a ringtone of a Dalek screaming ""Exterminate"" then). <br /><br />A few of the things I love about the new programme -- 1) people actually notice when Rose (Billie Piper) disappears off the planet. Some of the old shows an assistant would drop off for a while, and then come home like nothing has happened, no one noticed. 2) Chris Eccleston's doc loves Rose -- romantic or not will be debated, but there is no doubt that 9 loves and cares about his companion. He'd destroy the world if he had to to save her, which the old show was lacking -- often a doctor wouldn't care if he never saw his assistants again. 3) They talk and think like real people -- when Rose is shown something outlandish or new (such as aliens) she acts like a real person would -- gobsmacked. I never liked it when an assistant from the old show, who never saw anything alien, would just fit right in and adapt instantly. I want to see the surprise on Rose's face when she sees a plastic dummy come to life. She gives that to me. <br /><br />The few things I don't like about this series: 1)nearly everything happens on earth (London or Cardiff) and I was sort of hoping for a more off-world sort of show. 2) That Eccleston left so quickly, he really made the show brilliant. <br /><br />But I can let those few things go -- I far more enjoy the series than I ever expected to, so I don't mind if they have stuff set on earth. <br /><br />Just don't take this show seriously -- it's fun, it's smart, it's entertaining, but it's not a super-serious heavy duty show. It's pure fun, and pure British, and I can't get enough. Watch it with an open mind, and just put your brain into neutral and enjoy!<br /><br />ps -- don't watch series 2 or later. series 1 was brilliant, the first few episodes of series 2 were good, but don't watch it once it gets to Love and Monsters. Utter rubbish, completely destroys the show.",1
"Uninspired direction leaves a decent cast stranded in a handsome but bland adaptation, in which dialogue seems recited rather than heartfelt, and cash strapped appearances by the ghosts fail to round up any sense of awe or magic; Edward Woodward, as the Ghost of Christmas Present, wobbles around on stilts and seems to be doing an impression of Bernard Cribbins. As Scrooge, George C. Scott is too wry, and he never seems to truly believe in it, which robs his performance of its effect. The scenes in which he's shown his past have as much impact as if he was half-heartedly flicking through his family album. No one else seems to be putting any effort in, except Frank Finlay, who chronically overacts.",0
"I'm certainly glad that a film was made about Carl Brashear's amazing life story. Coming as it did during the Civil Rights era, Brashear became an inspiration for people of all minority groups not willing to settle for a status expected.<br /><br />Brashear as played by Cuba Gooding, Jr. leads by example in the conduct of the life he has chosen. Very similar to Jackie Robinson who integrated baseball and made it stick by his character and conduct. As Brashear, Gooding knows that he does not want the sharecropper life that his father Carl Lumbly has and Lumbly makes it real clear to get more out of life than he's gotten.<br /><br />But while Harry Truman integrated the Armed Services after World War II, the Navy still has its restrictions. A black man can only be a cook or an officer's valet, the real fighting parts are denied him. That's not good enough for Gooding who applies to become a Navy deep sea diver.<br /><br />Once at the diving school at Bayonne, New Jersey, Gooding gets it all thrown at him, mostly by the Master Chief Petty Officer in charge, Robert DeNiro. DeNiro may have some leftover prejudices, but he's nevertheless a hero and one who can inspire if one can get passed racial divide.<br /><br />The best thing about Men Of Honor is the chemistry between DeNiro and Gooding. They certainly come from different places, but as they get to know each other, both turn out to be Men Of Honor.<br /><br />Other good performances to note are Charlize Theron as DeNiro's wife and Hal Holbrook as the head of the diving school, a guy the Navy just wish would retire for reasons you'll see.<br /><br />Men Of Honor is an inspiring story about people with courage to spare and the ability to change.",1
"OK i own this DVD i got it new at amazon... i mean i think its badass and a pretty cool flick and melissa bale the slutty/bitchy girl they pick up is hot as hell ..., the acting sucks and the whole polt just sucks the clown is some huge guy wearing a mask and its disgusting but its OK i wouldn't recommend it if like u wanted to rent a good entertaining flick after a hard days work but if u have nothing else to do and ur obbsessed with this stupid movies like i am, watch it sometime, and i do not know how artisan DVD has S.I.C.K. in its DVD collection , s.i.c.k. is not good enough to be owned by a half way decent movie company OK well thats all",0
"Before Stan Laurel became the smaller half of the all-time greatest comedy team, he laboured under contract to Broncho Billy Anderson in a series of cheapies, many of which were parodies of major Hollywood features. Most of Laurel's 'parody' films are only mildly funny, and even less funny for modern audiences who haven't seen the original movie which Laurel is parodying. Fortunately, 'Mud and Sand' lampoons a movie which is still well known: 'Blood and Sand', starring Rudolph Valentino. 'Blood and Sand' was released only nine weeks before this parody, giving you some idea of how quickly Broncho Billy's movies were ground out, edited and distributed.<br /><br />Various sources (including IMDb) state that Stan Laurel's character in this film is named Rhubarb Vaselino, with a final 'o'. I've screened a print of 'Mud and Sand' with the original titles (in Hobo type font), so I report that Laurel's role is actually cried Rhubarb Vaseline, with an 'e'. But I agree that 'Vaselino' is funnier. Laurel copies the elaborate sideburns which Valentino wore in 'Blood and Sand' (he should've made them longer!), and there's a parody of Valentino's dressing scene from that movie, which made female movie-goers swoon in 1922. A señorita named Carmen in the original film is parodied here as Caramel (a girl I'd like to sink my teeth into).<br /><br />This movie (like the original) apparently takes place in Spain, yet there's a Prohibition gag. Laurel uses a distinctive hat-tipping gesture here which could have become a trademark for him (like Hardy's distinctive necktie twiddle), but I've never spotted it in any other Laurel film. There's some amusing dialogue: Rhubarb Vaseline tells the other matadors to 'Save a bull for me.' When Vaseline becomes a successful toreador, a lackey tells him 'The bull is without, sir' ... which is funny, but I was disappointed that Laurel didn't reply 'Without WHAT?'.<br /><br />There's one funny moment here which almost certainly wasn't planned, when Vaseline shows up for the bullfighter auditions. Laurel swaggers into the bullring, and -- before you can say 'corrida querida' -- he tosses a bull over the fence, where it lands with a thump near the other auditioners. The bull is obviously a fake, but the gag is funny anyway ... and, aye, there's a title card with a joke about 'throwing the bull'. The serendipitous moment occurs when Laurel repeats the gag, and Vaseline slings a second bull over the fence. This one lands on its butt, and balances upright for just an instant before toppling. VERY funny! If somebody planned that gag in this quickie comedy, I salute the unknown gagsmith ... and the tech man who rigged the bull to land in that position. More likely it happened by luck, and the director and editor were smart enough to keep it in.<br /><br />During the silent era, whenever Hollywood made a big-budget feature film which was set anyplace where the people don't speak English, it was a common cinematic device to show a piece of text or an inscription in the local lingo, then dissolve to a shot of the same text in English. I was surprised that this low-budget comedy spent the money to copy that device here: we see a notice-board outside the corrida with a message in Spanish, then it dissolves to the same text in English. Unfortunately, the photography in this cheapo movie is so dark that the effect is wasted.<br /><br />The actresses in this movie are attractive ... including Broncho Billy's wife Leona Anderson and Stan Laurel's common-law wife Mae Dahlberg; the latter briefly does a pretty dance. (Mae had danced in Stan's vaudeville act.) I was surprised to spot Charlie Chaplin's half-brother Wheeler Dryden in a brief role, since Chaplin had nothing to do with this movie. In 'Mud and Sand', Laurel gives a funny performance that's quite unlike his later familiar Stanley character ... but this film is much less funny than his brilliant work with Oliver Hardy. My rating: just 3 out of 10. TRIVIA NOTE: Twenty-three years later, in Stan Laurel's very last American film -- 'The Bullfighters' (1945) -- he again played a Spanish bullfighter (with his Spanish voice post-dubbed). Coincidentally, that film used stock footage from 'Blood and Sand': not Valentino's movie, but the Tyrone Power remake. 'Mud and Sand' is funnier than 'The Bullfighters', but not much.",0
"Average (and surprisingly tame) Fulci giallo which means it's still quite bad by normal standards, but redeemed by its solid build-up and some nice touches such as a neat time twist on the issues of visions and clairvoyance.<br /><br />The genre's well-known weaknesses are in full gear: banal dialogue, wooden acting, illogical plot points. And the finale goes on much too long, while the denouement proves to be a rather lame or shall I say: limp affair.<br /><br />Fulci's ironic handling of giallo norms is amusing, though. Yellow clues wherever you look.<br /><br />3 out of 10 limping killers",0
"Italy produced a lot of really great and original horror films in the 1960's - and this is certainly one of them! The first thing you will notice about Danse Macabre is the style of the film. Shot in beautiful black and white, and due to director Antonio Margheriti's use of lighting; the film almost looks like it could be a German expressionistic horror film. This, coupled with the horror-filled plot line ensures that Danse Macabre is a film that truly captures the essence of horror. Of course, the fact that the beautiful Barbara Steele appears in the film doesn't harm matters - and the good news continues as, in this film, she gets to flex her acting muscles more than she did in the films that made her famous. The plot is very aware of the time in which this was released, and so incorporates the great Edgar Allen Poe. We follow Alan Foster, a writer who accepts a bet from Poe himself and Lord Blackwood that he can't spend an entire night in the latter's creepy old castle. Everyone that has spent the night there previously has died...and our hero is about to meet the previous wager-takers! <br /><br />Nowadays, horror films don't tend to focus so much on each shot and the result is that there isn't much beauty left in the genre. It is refreshing, therefore, to see this film. Many of the shots here are incredibly beautiful - from the female side of the couple wearing just a see-through skirt, to my personal favourite - a shot of smoke creeping in from under a door. This my first Antonio Margheriti film, and even after seeing just this one; it's obvious that he was one of Italy's premier directors. Also interesting is the fact that screenplay was co-written by another of the Italian greats; Django creator Sergio Corbucci. The plot can meander a little too much at times, but there's always enough atmosphere on hand to make sure that the film never becomes boring - and the fact that it is always intriguing, even when the plot slows down, ensures the same thing. The way that Danse Macabre utilises the 'haunted house' theme is both well done and original, and helps to keep the story as eerie as possible. On the whole, fans of Italian and/or cult cinema will not want to miss this little gem!",1
"Deeply humorous yet honest comedy about a bunch of grownups (Bill Paxton, Julie Warner, Kevin Pollak, Elizabeth Perkins, Vincent Spano, Matt Craven, and Diane Lane) who are invited back to spend a week to Tomawka, a camp in (Ontario) Canada by their former consuelor (Alan Arkin). Writer/director Mike Binder drew upon his experience at the same camp as the main source of creating a gentle and understanding yarn that makes sense. Also, the movie has plenty of funny moments, some of which are completely bizarre like my favorite, the one involves using masking tape. Newton Thomas Sigel (""The Usual Suspects"", ""Three Kings"") provides the film with some impressive shots of the Canadian wilderness. Among the cast, Sam Raimi, director of ""THE EVIL DEAD"" films and ""The Gift"", appears here as Arkin's bumbling right-hand man. One more thing, this film reassured me that a camp doesn't have to be a site of bloody murders.",1
"I am a big fan of Fred MacMurray and Carole Lombard. And, in addition to them, Charles Butterworth (a very enjoyable supporting actor) was in this film,...so why didn't I particularly enjoy it?! Well, despite a good cast, this is one of the poorest written and most clichéd ""A pictures"" I have ever seen. Given the talent and money spent to make this film, it is shocking how slip-shod the writing was. I knew the film would be tedious when time after time early in the film I found myself predicting EXACTLY what would happen next--and I was always right! And this isn't because I am some sort of ""movie savant"", but was because almost no imagination or effort went into it. In fact, it seemed almost as if the film was just a long string of clichés all strung together! Also, I found it a bit irritating that Fred mistreated Carole so bad throughout the film and yet, true to convention, she came running to him in the end. Uggh! There is MORE suspense in a Lassie film (""will he bring people to rescue Timmy or will the rope he is dangling from break?"").<br /><br />Despite the very, very tired and clichéd script, there were a few positives about the film. It was pretty cool seeing Fred look like a broken lush at the end of the film--it was pretty believable and he looked like he hadn't eaten, shaved or slept in days. Also, Charles Butterworth's ""prattle"" did provide a few mildly humorous moments. But all this just wasn't enough to make this film look any different than a ""B movie"". It's a shame,...it could have been so much better.",0
